<?xml version="1.0" encoding="UTF-8"?>
<!--
This file contains the syntactic and semantic simple/atomic types.

The syntactic values for person are defined under pers-vals, and the
semantic types/sorts are defined under sem-obj. Indenting shows the
structure of the hierarchy. (In the general case, multiple parents may
be specified.)

Copyright (C) 2006 Michael White
$Revision: 1.4 $, $Date: 2006/05/20 20:34:16 $ 
-->
<types 
  name="tiny"
  xmlns:xsi="http://www.w3.org/2001/XMLSchema-instance" 
  xsi:noNamespaceSchemaLocation="../types.xsd"
>

  <!-- person vals -->
  <type name="pers-vals"/>
  <type name="3rd" parents="pers-vals"/>
  <type name="non-3rd" parents="pers-vals"/>
    <type name="1st" parents="non-3rd"/>
    <type name="2nd" parents="non-3rd"/>

  <!-- ontological sorts -->
  <type name="sem-obj"/>
    <type name="abstraction" parents="sem-obj property"/>
      <type name="direction" parents="abstraction location"/>
      <type name="measure" parents="abstraction"/>
        <type name="amt" parents="measure"/>
        <type name="dur" parents="measure"/>
        <type name="dist" parents="measure"/>
      <type name="num" parents="abstraction"/>
      <type name="ord" parents="abstraction"/>
      <type name="time" parents="abstraction"/>
    <type name="location" parents="sem-obj property"/>
      <type name="city" parents="location"/>
      <type name="place" parents="location"/>
    <type name="path" parents="sem-obj"/>
    <type name="phys-obj" parents="sem-obj"/>
      <type name="animate-being" parents="phys-obj"/>
        <type name="person" parents="animate-being"/>
      <type name="thing" parents="phys-obj"/>
        <type name="landmark" parents="thing location"/>
        <type name="road" parents="thing location"/>
	  <type name="property" parents="sem-obj"/>
    <type name="situation" parents="sem-obj"/>
      <type name="change" parents="situation"/>
        <type name="action" parents="change"/>
          <type name="turn" parents="action"/>
      <type name="state" parents="situation"/>

  <!--
	<type name="sem-obj"/>
    <type name="abstraction" parents="sem-obj"/>
      <type name="date" parents="abstraction"/>
      <type name="measure" parents="abstraction"/>
        <type name="amt" parents="measure"/>
        <type name="dur" parents="measure"/>
      <type name="num" parents="abstraction"/>
      <type name="time" parents="abstraction"/>
    <type name="location" parents="sem-obj"/>
      <type name="city" parents="location"/>
    <type name="entity" parents="sem-obj"/>
      <type name="causal-agent" parents="entity"/>
        <type name="organization" parents="causal-agent"/>
      <type name="mental-obj" parents="entity"/>
      <type name="phys-obj" parents="entity"/>
        <type name="animate-being" parents="phys-obj"/>
          <type name="person" parents="animate-being causal-agent"/>
    <type name="grouping" parents="sem-obj"/>
    <type name="situation" parents="sem-obj"/>
      <type name="change" parents="situation"/>
        <type name="action" parents="change"/>
          <type name="statement" parents="action"/>
        <type name="motion" parents="change"/>
      <type name="quantification" parents="situation"/>
      <type name="state" parents="situation"/>
        <type name="proposition" parents="state"/>
        <type name="experience" parents="state"/>
  -->  

</types>
