<?xml version="1.0" encoding="UTF-8"?>
<!-- 
      - This file is generated by parametric-types.xsl from parameter specs
	    (parameters.xml) to set up  types.xml file for development.
         
      - If the language in question has eg. quirky subjects etc., add their 
	    values under appropriate types.
	 
	 -->
<!--
	   subject-case, s-case, p-case and a-case are pre-defined types that are
	   used in the automatically generated initial lexicon (preset-families
	   .xml). We recommend that you dont change them. They handle
	   accusative/ergative mapping among other things (cf. types.xml initial
	   hierarchy).
	  
	 -->
<types xmlns:xsi="http://www.w3.org/2001/XMLSchema-instance" xsi:noNamespaceSchemaLocation="../types.xsd" name="Nez Perce">
  <type name="s-case" parents="subject-case"/>
  <type name="subject-case"/>
  <type parents="s-case" name="nom"/>
  <!--
		 Warning: Please substitute case names as children
		of a-case and p-case since these cannot be predicted parametrically
		for an unaligned language (cf. unknown and unknown2 values)
        -->
  <type parents="a-case" name="unknown"/>
  <type name="a-case"/>
  <type parents="p-case" name="unknown2"/>
  <type name="p-case"/>
</types>
