<?xml version="1.0" encoding="UTF-8"?>
<!--
This file contains the syntactic and semantic simple/atomic types.

The syntactic values for person are defined under pers-vals, and the
semantic types/sorts are defined under sem-obj. Indenting shows the
structure of the hierarchy. (In the general case, multiple parents may
be specified.)

Copyright (C) 2005 University of Edinburgh (Michael White)
$Revision: 1.1 $, $Date: 2005/01/22 12:53:35 $ 
-->
<types 
  name="tiny"
  xmlns:xsi="http://www.w3.org/2001/XMLSchema-instance" 
  xsi:noNamespaceSchemaLocation="../types.xsd"
>

  <!-- person vals -->
  <type name="pers-vals"/>
  <type name="3rd" parents="pers-vals"/>
  <type name="non-3rd" parents="pers-vals"/>
    <type name="1st" parents="non-3rd"/>
    <type name="2nd" parents="non-3rd"/>

  <!-- ontological sorts -->
  <type name="sem-obj"/>
    <type name="phys-obj" parents="sem-obj"/>
      <type name="animate-being" parents="phys-obj"/>
        <type name="person" parents="animate-being"/>
      <type name="thing" parents="phys-obj"/>
    <type name="situation" parents="sem-obj"/>
      <type name="change" parents="situation"/>
        <type name="action" parents="change"/>
      <type name="state" parents="situation"/>

</types>
